{
 "id": "T3",
 "title": "End-to-end walkthrough call (placeholder)",
 "kind": "transcript",
 "captured": "2026-10-08",
 "detail": "Call with Team A, Team C and Finance, speakers pseudonymised",
 "file": "inputs/walkthrough-call.txt",
 "sha256": "74b74d99dcd5ae8c9fe06bf63b22f1202c5688a791c15259784de6e38eea43dd",
 "coverage": "complete",
 "records": [
  {"locator": "00:00:04", "text": "Requesters send the request form by email to Team A.", "context": "Speaker A"},
  {"locator": "00:00:19", "text": "Team A logs every request in the tracker and checks it is complete.", "context": "Speaker A"},
  {"locator": "00:00:33", "text": "If anything is missing the request goes back to the requester.", "context": "Speaker A"},
  {"locator": "00:00:48", "text": "Urgent requests skip the queue and Team B looks at them the same day.", "context": "Speaker A"},
  {"locator": "00:01:05", "text": "Finance reserves the budget as soon as the category is set.", "context": "Speaker B"},
  {"locator": "00:01:21", "text": "Team C asks suppliers for quotes, usually three.", "context": "Speaker C"},
  {"locator": "00:01:37", "text": "We compare the quotes by hand and pick the cheapest suitable one.", "context": "Speaker C"},
  {"locator": "00:01:52", "text": "Team B puts the request, the quotes and the budget code into one approval pack.", "context": "Speaker A"},
  {"locator": "00:02:10", "text": "Anything over 10,000 needs a finance sign-off after the approver signs.", "context": "Speaker B"},
  {"locator": "00:02:26", "text": "If the approver has comments, the pack goes back to Team B.", "context": "Speaker A"},
  {"locator": "00:02:41", "text": "Once the order is raised, Finance commits the budget.", "context": "Speaker B"},
  {"locator": "00:02:58", "text": "Suppliers confirm the order in the supplier portal, but some never do.", "context": "Speaker C"},
  {"locator": "00:03:14", "text": "Chasing suppliers that have not confirmed takes most of a day each week.", "context": "Speaker C"},
  {"locator": "00:03:30", "text": "Invoices are matched to the order and the delivery before we pay.", "context": "Speaker B"},
  {"locator": "00:03:45", "text": "When the goods arrive the request is closed in the tracker.", "context": "Speaker A"},
  {"locator": "00:04:02", "text": "We would like AI to read the request form and log it for us.", "context": "Speaker A"},
  {"locator": "00:04:18", "text": "If we could automate the chasing, that would save Team C a lot of time.", "context": "Speaker C"},
  {"locator": "00:04:35", "text": "An AI draft of the approval pack would help Team B too.", "context": "Speaker B"},
  {"locator": "00:04:52", "text": "We are not sure what happens to the reserved budget when a request is rejected.", "context": "Speaker B"},
  {"locator": "00:05:08", "text": "Finance pays suppliers on the next payment run.", "context": "Speaker A"},
  {"locator": "00:05:24", "text": "We only ask approved suppliers for quotes, so we check the supplier in the portal first.", "context": "Speaker C"},
  {"locator": "00:05:40", "text": "Once Team B has reviewed a request, Team A marks it as reviewed in the tracker.", "context": "Speaker A"},
  {"locator": "00:05:57", "text": "The records team keeps a copy of every purchase order.", "context": "Speaker A"},
  {"locator": "00:06:13", "text": "When an invoice does not match, Team C queries it with the supplier and we match it again.", "context": "Speaker B"},
  {"locator": "00:06:30", "text": "When the goods arrive the requester rates the supplier on the request form.", "context": "Speaker A"}
 ]
}
