{
 "id": "WB1",
 "title": "Request steps workbook (placeholder)",
 "kind": "sheet",
 "captured": "2026-09-01",
 "detail": "Shared by Team A, one sheet",
 "file": "inputs/Steps.csv",
 "sha256": "408787d7c0dad75416cf95d200142feb8c2875c5e1ff1398aa81e9452e692b9b",
 "coverage": "complete",
 "records": [
  {"locator": "Steps!A1", "text": "Step"},
  {"locator": "Steps!B1", "text": "Owner"},
  {"locator": "Steps!C1", "text": "System"},
  {"locator": "Steps!D1", "text": "Note"},
  {"locator": "Steps!A2", "text": "Submit request", "context": "Step"},
  {"locator": "Steps!B2", "text": "Team A", "context": "Owner"},
  {"locator": "Steps!C2", "text": "Email", "context": "System"},
  {"locator": "Steps!D2", "text": "Request sent by email", "context": "Note"},
  {"locator": "Steps!A3", "text": "Log request", "context": "Step"},
  {"locator": "Steps!B3", "text": "Team B", "context": "Owner"},
  {"locator": "Steps!C3", "text": "Tracker", "context": "System"},
  {"locator": "Steps!D3", "text": "Logged in the tracker by hand", "context": "Note"},
  {"locator": "Steps!A4", "text": "Review request", "context": "Step"},
  {"locator": "Steps!B4", "text": "Team B", "context": "Owner"},
  {"locator": "Steps!D4", "text": "Checks the request is complete", "context": "Note"},
  {"locator": "Steps!A5", "text": "Request complete?", "context": "Step"},
  {"locator": "Steps!B5", "text": "Team B", "context": "Owner"},
  {"locator": "Steps!D5", "text": "Yes goes to approval; no goes back to Team A", "context": "Note"},
  {"locator": "Steps!A6", "text": "Approve request", "context": "Step"},
  {"locator": "Steps!B6", "text": "Team B", "context": "Owner"},
  {"locator": "Steps!D6", "text": "Approves requests up to the limit", "context": "Note"},
  {"locator": "Steps!A7", "text": "Record outcome", "context": "Step"},
  {"locator": "Steps!C7", "text": "Tracker", "context": "System"},
  {"locator": "Steps!D7", "text": "Outcome logged", "context": "Note"}
 ]
}
